{
  "schemaVersion": 1,
  "contextId": "patched-gui",
  "project": {"vcs": "jj", "workspace": ".", "revision": "@"},
  "layers": {
    "L01": {"variant": "local-build"},
    "L02": {"variant": "source-clean"},
    "L03": {"variant": "klibgen", "worktree": "vendor/gt-build/sources/patched/feenkcom/gtoolkit"},
    "L04": {"variant": "locked"},
    "L05": {"profile": "GUI"},
    "L06": {"profile": "GUI"},
    "L07": {"profile": "DEV"}
  }
}
