{
  "schemaVersion": 1,
  "contextId": "source-clean",
  "project": {"vcs": "jj", "workspace": ".", "revision": "@"},
  "layers": {
    "L01": {"variant": "local-build"},
    "L02": {"variant": "source-clean"},
    "L03": {"variant": "baseline"},
    "L04": {"variant": "locked"},
    "L05": {"profile": "CLI"},
    "L06": {"profile": "CLI"},
    "L07": {"profile": "DEV"}
  }
}
