{
  "schemaVersion": 1,
  "contextId": "default",
  "project": {
    "vcs": "jj",
    "workspace": ".",
    "revision": "@"
  },
  "layers": {
    "L01": {"variant": "downloaded"},
    "L02": {"variant": "release"},
    "L03": {"variant": "baseline"},
    "L04": {"variant": "locked"},
    "L05": {"profile": "CLI"},
    "L06": {"profile": "CLI"},
    "L07": {"profile": "DEV"}
  }
}
