{
  "schemaVersion": 1,
  "contextId": "gui",
  "project": {"vcs": "jj", "workspace": ".", "revision": "@"},
  "layers": {
    "L01": {"variant": "downloaded"},
    "L02": {"variant": "release"},
    "L03": {"variant": "baseline"},
    "L04": {"variant": "locked"},
    "L05": {"profile": "GUI"},
    "L06": {"profile": "GUI"},
    "L07": {"profile": "DEV"}
  }
}
