{
  "schemaVersion": 1,
  "contextId": "sqlite-local",
  "project": {"vcs": "jj", "workspace": ".", "revision": "@"},
  "layers": {
    "L01": {"variant": "downloaded"},
    "L02": {"variant": "release"},
    "L03": {"variant": "baseline"},
    "L04": {"variant": "locked", "dependencyOverrides": {"sqlite3": {"worktree": "vendor/gt/pharo-local/iceberg/pharo-rdbms/Pharo-SQLite3"}}},
    "L05": {"profile": "CLI"},
    "L06": {"profile": "CLI"},
    "L07": {"profile": "DEV"}
  }
}
